<?xml version="1.0" encoding="UTF-8"?>

<!-- generated on Tue Nov  4 23:07:07 2014 by SUMO netconvert Version dev-SVN-r17257
This data file and the accompanying materials
are made available under the terms of the Eclipse Public License v2.0
which accompanies this distribution, and is available at
http://www.eclipse.org/legal/epl-v20.html
SPDX-License-Identifier: EPL-2.0
<configuration xmlns:xsi="http://www.w3.org/2001/XMLSchema-instance" xsi:noNamespaceSchemaLocation="http://sumo.dlr.de/xsd/netconvertConfiguration.xsd">

    <input>
        <node-files value="./sumo/three_split.nod.xml"/>
        <edge-files value="./sumo/three_split.edg.xml"/>
    </input>

    <output>
        <output-file value="./sumo/three_split.net.xml"/>
    </output>

    <processing>
        <no-internal-links value="true"/>
    </processing>

    <report>
        <verbose value="true"/>
    </report>

</configuration>
-->

<net version="0.13" xmlns:xsi="http://www.w3.org/2001/XMLSchema-instance" xsi:noNamespaceSchemaLocation="http://sumo.dlr.de/xsd/net_file.xsd">

    <location netOffset="0.00,500.00" convBoundary="0.00,0.00,2500.00,1000.00" origBoundary="0.00,-500.00,2500.00,500.00" projParameter="!"/>

    <edge id="beg" from="absBeg" to="beg" priority="-1">
        <lane id="beg_0" index="0" speed="27.80" length="500.00" shape="0.00,498.35 495.25,498.35"/>
    </edge>
    <edge id="beg2left" from="beg" to="begleft" priority="-1">
        <lane id="beg2left_0" index="0" speed="13.90" length="503.09" shape="501.65,501.45 501.65,996.75"/>
    </edge>
    <edge id="beg2right" from="beg" to="begright" priority="-1">
        <lane id="beg2right_0" index="0" speed="13.90" length="500.00" shape="498.35,495.25 498.35,-0.05"/>
    </edge>
    <edge id="end" from="end" to="absEnd" priority="-1">
        <lane id="end_0" index="0" speed="27.80" length="500.00" shape="1504.75,498.35 2000.00,498.35"/>
    </edge>
    <edge id="left" from="begleft" to="endleft" priority="-1">
        <lane id="left_0" index="0" speed="13.90" length="1006.18" shape="503.25,998.35 1496.75,998.35"/>
    </edge>
    <edge id="left2end" from="endleft" to="end" priority="-1">
        <lane id="left2end_0" index="0" speed="13.90" length="503.09" shape="1498.35,996.75 1498.35,501.45"/>
    </edge>
    <edge id="middle" from="beg" to="end" priority="-1">
        <lane id="middle_0" index="0" speed="27.80" length="1000.00" shape="504.75,498.35 1495.25,498.35"/>
    </edge>
    <edge id="rend" from="absEnd" to="rabsEnd" priority="-1">
        <lane id="rend_0" index="0" speed="27.80" length="500.00" shape="2000.00,498.35 2500.00,498.35"/>
    </edge>
    <edge id="right" from="begright" to="endright" priority="-1">
        <lane id="right_0" index="0" speed="13.90" length="1000.00" shape="499.95,-1.65 1500.05,-1.65"/>
    </edge>
    <edge id="right2end" from="endright" to="end" priority="-1">
        <lane id="right2end_0" index="0" speed="13.90" length="500.00" shape="1501.65,-0.05 1501.65,495.25"/>
    </edge>

    <junction id="absBeg" type="unregulated" x="0.00" y="500.00" incLanes="" intLanes="" shape="-0.00,499.95 -0.00,496.75"/>
    <junction id="absEnd" type="priority" x="2000.00" y="500.00" incLanes="end_0" intLanes="" shape="2000.00,499.95 2000.00,496.75 2000.00,499.95">
        <request index="0" response="0" foes="0"/>
    </junction>
    <junction id="beg" type="priority" x="500.00" y="500.00" incLanes="beg_0" intLanes="" shape="500.05,501.45 503.25,501.45 504.75,499.95 504.75,496.75 499.95,495.25 496.75,495.25 495.25,496.75 495.25,499.95">
        <request index="0" response="000" foes="000"/>
        <request index="1" response="000" foes="000"/>
        <request index="2" response="000" foes="000"/>
    </junction>
    <junction id="begleft" type="priority" x="500.00" y="1000.00" incLanes="beg2left_0" intLanes="" shape="503.25,999.95 503.25,996.75 500.05,996.75">
        <request index="0" response="0" foes="0"/>
    </junction>
    <junction id="begright" type="priority" x="500.00" y="0.00" incLanes="beg2right_0" intLanes="" shape="496.75,-0.05 499.95,-0.05 499.95,-3.25">
        <request index="0" response="0" foes="0"/>
    </junction>
    <junction id="end" type="priority" x="1500.00" y="500.00" incLanes="left2end_0 right2end_0 middle_0" intLanes="" shape="1496.75,501.45 1499.95,501.45 1504.75,499.95 1504.75,496.75 1503.25,495.25 1500.05,495.25 1495.25,496.75 1495.25,499.95">
        <request index="0" response="110" foes="110"/>
        <request index="1" response="100" foes="101"/>
        <request index="2" response="000" foes="011"/>
    </junction>
    <junction id="endleft" type="priority" x="1500.00" y="1000.00" incLanes="left_0" intLanes="" shape="1499.95,996.75 1496.75,996.75 1496.75,999.95">
        <request index="0" response="0" foes="0"/>
    </junction>
    <junction id="endright" type="priority" x="1500.00" y="0.00" incLanes="right_0" intLanes="" shape="1500.05,-0.05 1503.25,-0.05 1500.05,-3.25 1500.05,-0.05">
        <request index="0" response="0" foes="0"/>
    </junction>
    <junction id="rabsEnd" type="unregulated" x="2500.00" y="500.00" incLanes="rend_0" intLanes="" shape="2500.00,496.75 2500.00,499.95"/>

    <connection from="beg" to="beg2right" fromLane="0" toLane="0" dir="r" state="M"/>
    <connection from="beg" to="middle" fromLane="0" toLane="0" dir="s" state="M"/>
    <connection from="beg" to="beg2left" fromLane="0" toLane="0" dir="l" state="M"/>
    <connection from="beg2left" to="left" fromLane="0" toLane="0" dir="r" state="M"/>
    <connection from="beg2right" to="right" fromLane="0" toLane="0" dir="l" state="M"/>
    <connection from="end" to="rend" fromLane="0" toLane="0" dir="s" state="M"/>
    <connection from="left" to="left2end" fromLane="0" toLane="0" dir="r" state="M"/>
    <connection from="left2end" to="end" fromLane="0" toLane="0" dir="l" state="m"/>
    <connection from="middle" to="end" fromLane="0" toLane="0" dir="s" state="M"/>
    <connection from="right" to="right2end" fromLane="0" toLane="0" dir="l" state="M"/>
    <connection from="right2end" to="end" fromLane="0" toLane="0" dir="r" state="m"/>

</net>
